{
  "id": "vv5_full_heal_native_abi_evidence_gate",
  "game_id": "vv5",
  "enabled": false,
  "catalog_hidden": true,
  "catalog_enabled": false,
  "publication_ready": false,
  "native_output": false,
  "status": "STOP: native Full Heal ABIs and player lifecycle evidence are unproved",
  "stock": {"filename": "Virtual Villagers - New Believers.exe", "size": 991232, "sha256": "92946781980220E9D1A2E6C573925519934608F5215F4A0F8CE3B90088C5C65D"},
  "folder_evidence": {"schema": "vvfp.full-folder-inventory.v1", "authenticated": false, "complete": false, "file_count": null, "total_size": null, "unexpected_files": [], "manifest_sha256": null, "receipt_sha256": null},
  "record_contract": {
    "count": 150, "stride": "0x2F44", "active_offset": "0x1CD4",
    "faction_offset": "0x1CEC", "health_offset": "0x1C40",
    "forbidden_unproved_offset": "0x1CE1",
    "exclusion_policy": {"never_read": ["0x1CE1"], "never_write": ["0x1CE1"], "never_use_as_eligibility_guard": ["0x1CE1"], "status": "unproved and excluded"},
    "read_order": ["active", "faction_equals_zero", "positive_health", "native_sickness"],
    "sickness_offset": null, "sickness_semantic": null
  },
  "native_abis": {
    "record_world_resolver": {"va": null, "stock_bytes": null, "continuation_va": null, "calling_convention": null, "artifact_sha256": null, "stable_identity_verified": false},
    "sickness_clearer": {"va": null, "stock_bytes": null, "continuation_va": null, "calling_convention": null, "artifact_sha256": null, "exact_clear_readback_verified": false},
    "health_setter": {"va": null, "stock_bytes": null, "continuation_va": null, "calling_convention": null, "artifact_sha256": null, "target_health": 100, "exact_readback_verified": false},
    "people_cured": {"increment_va": null, "readback_va": null, "stock_bytes": null, "calling_convention": null, "artifact_sha256": null, "stat_verified": false, "trophy_behavior_verified": false, "notification_behavior_verified": false},
    "funds_account": {"getter_va": null, "deduction_va": null, "stock_bytes": null, "calling_convention": null, "artifact_sha256": null, "price": 30000, "one_deduction_readback_verified": false}
  },
  "transaction_evidence": {
    "folder_manifest_sha256": null, "dry_run_artifact_sha256": null,
    "confirmation_artifact_sha256": null, "postverify_artifact_sha256": null,
    "partial_rollback_artifact_sha256": null, "predicted_actual_counts_verified": false,
    "overlap_counts_both_verified": false, "deduction_after_postverify_verified": false,
    "partial_effect_boundary_verified": false, "rollback_disclosure_verified": false
  },
  "messages": {
    "label": "Full Heal / Cure All",
    "prompt": "Full Heal / Cure All will cure X sick villagers and restore Y partial-health villagers to exactly 100 for 30,000 tech points?",
    "sick_result": "X sick villagers were cured",
    "partial_result": "Y partial-health villagers were restored to exactly 100",
    "singular_plural_verified": false
  },
  "ui_lifecycle": {
    "resource": "0x6A", "dimensions": [96, 39], "local": [137, 2],
    "event": 13, "factory_va": "0x401BD0", "ownership_va": "0x40C680",
    "windowed_receipt_sha256": null, "fullscreen_receipt_sha256": null,
    "owner_verified": false, "centering_verified": false,
    "fullscreen_restore_verified": false, "child_destructor_verified": false
  },
  "composition": {
    "origins_range": "0xDB000-0xDC000", "full_mastery_range": "0xF2000-0xF4000",
    "running_range": "0xF4000-0xF6000", "ui_ranges": [], "full_heal_ranges": [],
    "patches": [], "hooks": [], "caves": [], "overlap_report_sha256": null,
    "expanded_rejected": true, "expanded_lifecycle_verified": false
  }
}
